{
  "schema": "prospektweb.calc.module/v1",
  "familyId": "brochure_fragment",
  "version": "1.0.0",
  "kind": "binding-fragment",
  "status": "published",
  "name": "Брошюра: блок и обложка",
  "description": "Многосоставной фрагмент с двумя независимыми экземплярами печатного блока и этапом сборки.",
  "content": {
    "rootNodeId": "brochure",
    "nodes": [
      {"nodeId": "brochure", "nodeType": "binding", "order": 0, "name": "Брошюра", "childNodeIds": ["block", "cover", "assembly"]},
      {"nodeId": "block", "nodeType": "detail", "order": 0, "name": "Блок", "dependencyRef": "blockModule"},
      {"nodeId": "cover", "nodeType": "detail", "order": 1, "name": "Обложка", "dependencyRef": "coverModule"},
      {"nodeId": "assembly", "nodeType": "stage", "order": 2, "name": "Сборка", "logic": {"version": 1, "vars": [{"name": "assembledItemsQty", "formula": "quantity"}]}}
    ]
  },
  "ports": [
    {"code": "quantity", "direction": "input", "valueType": "number", "required": true, "unit": "piece"},
    {"code": "bindingReservePercent", "direction": "global-input", "valueType": "number", "required": true, "unit": "percent"},
    {"code": "assembledItemsQty", "direction": "output", "valueType": "number", "required": true, "unit": "piece"}
  ],
  "entityRoles": [
    {"code": "bindingOperation", "entityType": "operation", "cardinality": "one", "description": "Операция сборки выбирается в экземпляре."},
    {"code": "bindingEquipment", "entityType": "equipment", "cardinality": "optional", "description": "Оборудование сборки выбирается в экземпляре."}
  ],
  "dependencies": [
    {"ref": "blockModule", "familyId": "printed_block", "versionRange": "1.0.0"},
    {"ref": "coverModule", "familyId": "printed_block", "versionRange": "1.0.0"}
  ],
  "tests": [
    {"name": "Брошюра 100 экземпляров", "inputs": {"quantity": 100}, "expectedOutputs": {"detailCount": 2, "assemblyStageCount": 1}}
  ],
  "contentHash": "ff5120bc3aca9e40501b1b1dcef99b81fc866fdac452235096c99f299cd327b0",
  "provenance": {"createdAt": "2026-07-25T00:00:00Z", "createdBy": "prospektweb", "source": "vertical-fragment-pilot"}
}
