{
  "schema": "prospektweb.calc.module/v1",
  "familyId": "printed_block",
  "version": "1.0.0",
  "kind": "detail",
  "status": "published",
  "name": "Печатный блок",
  "description": "Деталь печатного блока с зависимостью от точной версии универсального этапа печати.",
  "content": {
    "rootNodeId": "block",
    "nodes": [
      {"nodeId": "block", "nodeType": "detail", "order": 0, "name": "Печатный блок", "childNodeIds": ["print"]},
      {"nodeId": "print", "nodeType": "stage", "order": 0, "name": "Печать блока", "dependencyRef": "digitalPrint"}
    ]
  },
  "ports": [
    {"code": "quantity", "direction": "input", "valueType": "number", "required": true, "unit": "piece"},
    {"code": "blockWidthMm", "direction": "input", "valueType": "number", "required": true, "unit": "mm"},
    {"code": "blockLengthMm", "direction": "input", "valueType": "number", "required": true, "unit": "mm"},
    {"code": "pages", "direction": "input", "valueType": "number", "required": true, "unit": "page"},
    {"code": "paperDensityGm2", "direction": "global-input", "valueType": "number", "required": true, "unit": "g/m2"},
    {"code": "blockSheetsQty", "direction": "output", "valueType": "number", "required": true, "unit": "sheet"}
  ],
  "entityRoles": [
    {"code": "blockPaper", "entityType": "material", "cardinality": "one", "description": "Бумага блока выбирается в экземпляре."}
  ],
  "dependencies": [
    {"ref": "digitalPrint", "familyId": "digital_sheet_print", "versionRange": "^1.0.0"}
  ],
  "tests": [
    {"name": "Блок 16 полос", "inputs": {"pages": 16}, "expectedOutputs": {"childStageCount": 1}},
    {"name": "Блок 64 полосы", "inputs": {"pages": 64}, "expectedOutputs": {"childStageCount": 1}}
  ],
  "contentHash": "9dc98d2254b28bd2341eea0a5d4c4e582a13e242cc21aeb0992b5274204e1c03",
  "provenance": {"createdAt": "2026-07-25T00:00:00Z", "createdBy": "prospektweb", "source": "vertical-detail-pilot"}
}
